{
    "treatyType": "Catastrophe Excess of Loss Reinsurance",
    "insured": "PQR Insurance Company",
    "reinsurer": "ABC Reinsurance Company",
    "period": {
        "start": "1st October 2023",
        "end": "30th September 2024"
    },
    "lossLayers": [
        {
            "layer": 1,
            "excessOf": 20000000,
            "limit": 10000000,
            "reinsuredPercent": 100
        },
        {
            "layer": 2,
            "excessOf": 30000000,
            "limit": 20000000,
            "reinsuredPercent": 90
        },
        {
            "layer": 3,
            "excessOf": 50000000,
            "limit": 30000000,
            "reinsuredPercent": 80
        },
        {
            "layer": 4,
            "excessOf": 80000000,
            "limit": 40000000,
            "reinsuredPercent": 70
        },
        {
            "layer": 5,
            "excessOf": 120000000,
            "limit": 50000000,
            "reinsuredPercent": 60
        },
        {
            "layer": 6,
            "excessOf": 170000000,
            "limit": 60000000,
            "reinsuredPercent": 50
        }
    ],
    "interest": "Covers all lines of business of the Insured including Property, Liability, and Surety.",
    "sumInsured": 150000000,
    "commission": {
        "percent": 20,
        "maxLossRatio": 75
    },
    "exclusions": [
        "Wildfire risks",
        "environmental pollution",
        "product recall",
        "insolvency"
    ],
    "claimsNotification": 60,
    "arbitrationClause": "Any dispute arising from this contract shall be settled by arbitration in accordance with the rules of the International Centre for Dispute Resolution.",
    "currency": "USD"
}